<?xml version='1.0' encoding='UTF-8' standalone='no' ?>
<!-- <?xml-stylesheet type='text/xsl' href='hotel_txt_1.xsl'?> -->

<?xml-stylesheet type="text/xsl" href="hotel_xml_1.xsl"?>
<hotel
    xmlns:xsi='http://www.w3.org/2001/XMLSchema-instance'
    xsi:noNamespaceSchemaLocation='hotel.xsd'>
    
    <hotel_address>Варна, ул. &quot;Рупи&quot; 3</hotel_address>
    <name_en>St St Constantine And Helena</name_en>
    <name_bg>Св. св. Константин и Елена</name_bg>
    <image>https://exp.cdn-hotels.com/hotels/1000000/580000/578700/578692/578692_93_z.jpg</image>
    <hotel_rooms>
        <room floor='2' type='L22'>
            <number>213</number>
        </room>
        <room floor='3' type='L55'>
            <number>301</number>
        </room>
        <room floor='4' type='L44'>
            <number>426</number>
        </room>
        <room floor='3' type='L22'>
            <number>321</number>
        </room>
        <room floor='2' type='L32'>
            <number>230</number>
        </room>
    </hotel_rooms>
    <room_bookings>
        <guests>
            <guest number='22'>
                <phone>0883398444</phone>
                <name>Петя Димова</name>
                <address>ж.к.&quot;Красно село&quot;, ул.&quot;цар Калоян&quot; 30</address>
                <city>гр.София</city>
            </guest>
            <guest number='26'>
                <phone>0875553421</phone>
                <name>Денислав Божинов</name>
                <address>ж.к.&quot;Надежда&quot;,бул.&quot;Ломско шосе&quot; 12</address>
                <city>гр.София</city>
            </guest>
            <guest number='54'>
                <phone>0885060701</phone>
                <name>Костадин Иванов</name>
                <address>ж.к.&quot;Запад&quot; 50</address>
                <city>гр.Пазарджик</city>
            </guest>
            <guest number='38'>
                <phone>0896129912</phone>
                <name>Патрисия Величкова</name>
                <address>ж.к.&quot;Воден&quot;, ул.&quot;Гренадерска&quot; 45</address>
                <city>гр.Плевен</city>
            </guest>
            <guest number='16'>
                <phone>0895231154</phone>
                <name>Кирил Беновски</name>
                <address>ул.&quot;Кала тепе&quot; 33</address>
                <city>гр.Плевен</city>
            </guest>
        </guests>
        <booking id='b1582' guests='54'>
            <fromDate>2017-01-21</fromDate>
            <toDate>2017-01-26</toDate>
            <reason>почивка</reason>
        </booking>
        <booking id='b2175' guests='22 26'>
            <fromDate>2015-05-05</fromDate>
            <toDate>2015-05-12</toDate>
            <reason>семейна екскурзия</reason>
        </booking>
        <booking id='b3546' guests='38 16'>
            <fromDate>2015-06-15</fromDate>
            <toDate>2015-06-25</toDate>
            <reason>меден месец</reason>
        </booking>
    </room_bookings>
    
    <room_types>
        <type code='L22' smoking='NO'>
            <type_name>Делукс стая</type_name>
            <description><![CDATA[
                1 кралско легло
                Релакс - наличен масажист в стаята
                Забавление - безплатен WiFi, телевизор с плосък екран с кабелна, iPod докове
                Храна и напитки - денонощен рум сервиз, минибар, безплатна ботилирана вода
                Спане - спално бельо от египетски памук, избор на възглавници
                Баня - лична баня, вана или душ-кабина, халати и хавлии
                Комфорт - климатик, ежедневно почистване
                Достъпен за инвалидни колички
                Възможност за заявка на свързани стаи
            ]]>  
            </description>
            <standard_rate>
                <period_summer>2460</period_summer>
                <period_winter>2460</period_winter>
            </standard_rate>
        </type>
        <type code='L32' smoking='YES'>
            <type_name>Луксозна двойна стая</type_name>
            <description><![CDATA[
                1 двойно легло
                Релакс - наличен масажист в стаята
                Забавление - безплатен WiFi, телевизор с плосък екран с кабелна, iPod докове
                Храна и напитки - денонощен рум сервиз, минибар, безплатна ботилирана вода
                Спане - спално бельо от египетски памук, избор на възглавници
                Баня - лична баня, вана или душ-кабина, халати и хавлии
                Комфорт - климатик, ежедневно почистване
                Възможност за заявка на свързани стаи
            ]]>  
            </description>
            <standard_rate>
                <period_summer>1940</period_summer>
                <period_winter>1840</period_winter>
            </standard_rate>
        </type>   
        <type code='L44' smoking='YES'>
            <type_name>Президентски апартамент</type_name>
            <description><![CDATA[
                1 кралско легло
                Релакс - наличен масажист в стаята
                Забавление - безплатен WiFi, телевизор с плосък екран с кабелна, iPod докове
                Храна и напитки - денонощен рум сервиз, минибар, безплатна ботилирана вода
                Спане - спално бельо от египетски памук, избор на възглавници
                Баня - лична баня, вана или душ-кабина, халати и хавлии
                Комфорт - климатик, ежедневно почистване
                Възможност за заявка на свързани стаи
            ]]>  
            </description>
            <standard_rate>
                <period_summer>4250</period_summer>
                <period_winter>4200</period_winter>
            </standard_rate>
        </type>   
        <type code='L55' smoking='NO'>
            <type_name>Семеен апартамент</type_name>
            <description><![CDATA[
                Отделни спални - една с кралско легло и една с 2-3 единични
                Релакс - наличен масажист в стаята
                Забавление - безплатен WiFi, телевизор с плосък екран с кабелна, iPod докове
                Храна и напитки - денонощен рум сервиз, минибар, безплатна ботилирана вода
                Спане - спално бельо от египетски памук, избор на възглавници
                Баня - лична баня, вана или душ-кабина, халати и хавлии
                Комфорт - климатик, ежедневно почистване
                Възможност за заявка на свързани стаи
            ]]>  
            </description>
            <standard_rate>
                <period_summer>3100</period_summer>
                <period_winter>2500</period_winter>
            </standard_rate>
        </type>
    </room_types>
</hotel>
